[CHÍNH HÃNG] Đàn Piano Điện Victor VT02 - 88 Phím - Tặng Full Phụ Kiện,Khoá Học Online - HIẾU ÂM NHẠC	2,8tr	1k+	Hiếu Âm Nhạc	11,50%	₫308.000	https://shopee.vn/product/82693855/24683811499	https://s.shopee.vn/8pgcTUbLsD	1.png
Đàn Piano Điện Gấp Gọn 2025 - 88 Phím Nặng Cảm Lực - Kết Nối Bluetooth + Chân Đàn	1,2tr	909	FROSTY AIR	9,50%	₫107.100	https://shopee.vn/product/1119829889/24001962299	https://s.shopee.vn/9002fnaiXG	2.png
Đàn Piano Điện VicTor VT02 Phiên Bản 2026 - Đủ 88 Phím Đàn Gỗ Chất Lượng  - Tặng Pedal và đủ Pk, Khóa học online	2,8tr	2k+	Guitar-Uku-Phụ kiện đàn	4,50%	₫111.360	https://shopee.vn/product/626295262/25923019757	https://s.shopee.vn/9AJSs6a5CJ	3.png
[Tặng Pedal, Tai Nghe, Giáo Trình] Đàn Piano Gỗ Woim W-3101 88 Phím Nặng Chuẩn Quốc Tế, Midi, Bluetooth, Âm Bass Treble.	3,5tr	576	Music Boutique	9,50%	₫314.100	https://shopee.vn/product/94688546/24378715908	https://s.shopee.vn/6fc7tVjbGq	4.png
Đàn Piano Điện Victor VT02 Bản 2026 - 88 Phím, Bluetooth -Tặng Full Phụ Kiện, Khoá Học Piano Online	2,7tr	844	Piano House Store	7,50%	₫191.100	https://shopee.vn/product/1532209200/24244895736	https://s.shopee.vn/6pvY5oixvt	5.png
Đàn Piano Điện Bora BX 20 Gấp Gọn - 88 Phím Nặng Cảm Lực - Kết Nối Bluetooth + Chân Đàn +TPhone	1,9tr	6k+	TỔNG KHO NHẠC CỤ VĂN QUỐC	4,50%	₫76.000	https://shopee.vn/product/65467233/23127244864	https://s.shopee.vn/70EyI7iKaw	6.png
